[
  {
    "v": 1,
    "seq": 1,
    "thread_id": "th_1",
    "task_id": "tk_1",
    "run_id": null,
    "ts": "2026-10-27T22:00:01.000Z",
    "event": {
      "type": "UserMessage",
      "message_id": "msg_1",
      "parts": [
        {
          "type": "text",
          "text": "Open the report."
        }
      ],
      "author": {
        "kind": "user",
        "id": "usr_local"
      }
    }
  },
  {
    "v": 1,
    "seq": 2,
    "thread_id": "th_1",
    "task_id": "tk_1",
    "run_id": "run_1",
    "ts": "2026-10-27T22:00:01.000Z",
    "event": {
      "type": "RunStarted",
      "reason": "prompt"
    }
  },
  {
    "v": 1,
    "seq": 3,
    "thread_id": "th_1",
    "task_id": "tk_1",
    "run_id": "run_1",
    "ts": "2026-10-27T22:00:02.000Z",
    "event": {
      "type": "ToolCallStart",
      "tool_call_id": "call_r1",
      "title": "Fetch report",
      "kind": "fetch",
      "status": "in_progress"
    },
    "raw": {
      "source": "acp",
      "payload": {
        "sessionUpdate": "tool_call",
        "toolCallId": "call_r1",
        "title": "Fetch report",
        "kind": "fetch",
        "status": "in_progress"
      }
    }
  },
  {
    "v": 1,
    "seq": 4,
    "thread_id": "th_1",
    "task_id": "tk_1",
    "run_id": "run_1",
    "ts": "2026-10-27T22:00:03.000Z",
    "event": {
      "type": "ToolCallResult",
      "tool_call_id": "call_r1",
      "content": [
        {
          "type": "text",
          "text": "plain text"
        },
        {
          "type": "file",
          "name": "report.pdf",
          "mime_type": "application/pdf",
          "url": "https://example.com/report.pdf",
          "size": 1024
        },
        {
          "type": "text",
          "text": "embedded text"
        }
      ],
      "raw_output": {
        "status": 200
      }
    },
    "raw": {
      "source": "acp",
      "payload": {
        "sessionUpdate": "tool_call_update",
        "toolCallId": "call_r1",
        "status": "completed",
        "content": [
          {
            "type": "content",
            "content": {
              "type": "text",
              "text": "plain text"
            }
          },
          {
            "type": "content",
            "content": {
              "type": "resource_link",
              "name": "report.pdf",
              "uri": "https://example.com/report.pdf",
              "mimeType": "application/pdf",
              "size": 1024
            }
          },
          {
            "type": "content",
            "content": {
              "type": "resource_link",
              "name": "insecure",
              "uri": "http://example.com/insecure"
            }
          },
          {
            "type": "content",
            "content": {
              "type": "image",
              "data": "iVBORw0KGgo=",
              "mimeType": "image/png"
            }
          },
          {
            "type": "content",
            "content": {
              "type": "resource",
              "resource": {
                "uri": "file:///workspace/a.txt",
                "mimeType": "text/plain",
                "text": "embedded text"
              }
            }
          },
          {
            "type": "content",
            "content": {
              "type": "resource",
              "resource": {
                "uri": "file:///workspace/b.bin",
                "mimeType": "application/octet-stream",
                "blob": "AAEC"
              }
            }
          }
        ],
        "rawOutput": {
          "status": 200
        }
      }
    }
  },
  {
    "v": 1,
    "seq": 5,
    "thread_id": "th_1",
    "task_id": "tk_1",
    "run_id": "run_1",
    "ts": "2026-10-27T22:00:03.000Z",
    "event": {
      "type": "ToolCallEnd",
      "tool_call_id": "call_r1",
      "status": "completed"
    },
    "raw": {
      "source": "acp",
      "payload": {
        "sessionUpdate": "tool_call_update",
        "toolCallId": "call_r1",
        "status": "completed",
        "content": [
          {
            "type": "content",
            "content": {
              "type": "text",
              "text": "plain text"
            }
          },
          {
            "type": "content",
            "content": {
              "type": "resource_link",
              "name": "report.pdf",
              "uri": "https://example.com/report.pdf",
              "mimeType": "application/pdf",
              "size": 1024
            }
          },
          {
            "type": "content",
            "content": {
              "type": "resource_link",
              "name": "insecure",
              "uri": "http://example.com/insecure"
            }
          },
          {
            "type": "content",
            "content": {
              "type": "image",
              "data": "iVBORw0KGgo=",
              "mimeType": "image/png"
            }
          },
          {
            "type": "content",
            "content": {
              "type": "resource",
              "resource": {
                "uri": "file:///workspace/a.txt",
                "mimeType": "text/plain",
                "text": "embedded text"
              }
            }
          },
          {
            "type": "content",
            "content": {
              "type": "resource",
              "resource": {
                "uri": "file:///workspace/b.bin",
                "mimeType": "application/octet-stream",
                "blob": "AAEC"
              }
            }
          }
        ],
        "rawOutput": {
          "status": 200
        }
      }
    }
  },
  {
    "v": 1,
    "seq": 6,
    "thread_id": "th_1",
    "task_id": "tk_1",
    "run_id": "run_1",
    "ts": "2026-10-27T22:00:04.000Z",
    "event": {
      "type": "RunFinished",
      "outcome": {
        "type": "success",
        "stop_reason": "end_turn"
      }
    },
    "raw": {
      "source": "acp",
      "payload": {
        "stopReason": "end_turn"
      }
    }
  }
]
