[
  {
    "v": 1,
    "seq": 1,
    "thread_id": "th_1",
    "task_id": "tk_1",
    "run_id": null,
    "ts": "2026-10-27T22:00:01.000Z",
    "event": {
      "type": "UserMessage",
      "message_id": "msg_1",
      "parts": [
        {
          "type": "text",
          "text": "Switch modes."
        }
      ],
      "author": {
        "kind": "user",
        "id": "usr_local"
      }
    }
  },
  {
    "v": 1,
    "seq": 2,
    "thread_id": "th_1",
    "task_id": "tk_1",
    "run_id": "run_1",
    "ts": "2026-10-27T22:00:01.000Z",
    "event": {
      "type": "RunStarted",
      "reason": "prompt"
    }
  },
  {
    "v": 1,
    "seq": 3,
    "thread_id": "th_1",
    "task_id": "tk_1",
    "run_id": "run_1",
    "ts": "2026-10-27T22:00:02.000Z",
    "event": {
      "type": "TextMessageStart",
      "message_id": "msg_2",
      "role": "assistant"
    }
  },
  {
    "v": 1,
    "seq": 4,
    "thread_id": "th_1",
    "task_id": "tk_1",
    "run_id": "run_1",
    "ts": "2026-10-27T22:00:02.000Z",
    "event": {
      "type": "TextMessageContent",
      "message_id": "msg_2",
      "delta": "Switching."
    },
    "raw": {
      "source": "acp",
      "payload": {
        "sessionUpdate": "agent_message_chunk",
        "content": {
          "type": "text",
          "text": "Switching."
        }
      }
    }
  },
  {
    "v": 1,
    "seq": 5,
    "thread_id": "th_1",
    "task_id": "tk_1",
    "run_id": "run_1",
    "ts": "2026-10-27T22:00:03.000Z",
    "event": {
      "type": "TextMessageEnd",
      "message_id": "msg_2"
    }
  },
  {
    "v": 1,
    "seq": 6,
    "thread_id": "th_1",
    "task_id": null,
    "run_id": null,
    "ts": "2026-10-27T22:00:03.000Z",
    "event": {
      "type": "StateSnapshot",
      "scope": "session",
      "snapshot": {
        "available_commands": [],
        "current_mode_id": "code",
        "modes": [],
        "config_options": []
      }
    },
    "raw": {
      "source": "acp",
      "payload": {
        "sessionUpdate": "current_mode_update",
        "currentModeId": "code"
      }
    }
  },
  {
    "v": 1,
    "seq": 7,
    "thread_id": "th_1",
    "task_id": null,
    "run_id": null,
    "ts": "2026-10-27T22:00:04.000Z",
    "event": {
      "type": "StateDelta",
      "scope": "session",
      "patch": [
        {
          "op": "replace",
          "path": "/current_mode_id",
          "value": "plan"
        }
      ]
    },
    "raw": {
      "source": "acp",
      "payload": {
        "sessionUpdate": "current_mode_update",
        "currentModeId": "plan"
      }
    }
  },
  {
    "v": 1,
    "seq": 8,
    "thread_id": "th_1",
    "task_id": "tk_1",
    "run_id": "run_1",
    "ts": "2026-10-27T22:00:06.000Z",
    "event": {
      "type": "RunFinished",
      "outcome": {
        "type": "success",
        "stop_reason": "end_turn"
      }
    },
    "raw": {
      "source": "acp",
      "payload": {
        "stopReason": "end_turn"
      }
    }
  }
]
