[
  {
    "v": 1,
    "seq": 1,
    "thread_id": "th_1",
    "task_id": "tk_1",
    "run_id": null,
    "ts": "2026-10-27T22:00:01.000Z",
    "event": {
      "type": "UserMessage",
      "message_id": "msg_1",
      "parts": [
        {
          "type": "text",
          "text": "Run it."
        }
      ],
      "author": {
        "kind": "user",
        "id": "usr_local"
      }
    }
  },
  {
    "v": 1,
    "seq": 2,
    "thread_id": "th_1",
    "task_id": "tk_1",
    "run_id": "run_1",
    "ts": "2026-10-27T22:00:01.000Z",
    "event": {
      "type": "RunStarted",
      "reason": "prompt"
    }
  },
  {
    "v": 1,
    "seq": 3,
    "thread_id": "th_1",
    "task_id": "tk_1",
    "run_id": "run_1",
    "ts": "2026-10-27T22:00:02.000Z",
    "event": {
      "type": "TextMessageStart",
      "message_id": "msg_2",
      "role": "assistant"
    }
  },
  {
    "v": 1,
    "seq": 4,
    "thread_id": "th_1",
    "task_id": "tk_1",
    "run_id": "run_1",
    "ts": "2026-10-27T22:00:02.000Z",
    "event": {
      "type": "TextMessageContent",
      "message_id": "msg_2",
      "delta": "Running."
    },
    "raw": {
      "source": "acp",
      "payload": {
        "sessionUpdate": "agent_message_chunk",
        "content": {
          "type": "text",
          "text": "Running."
        }
      }
    }
  },
  {
    "v": 1,
    "seq": 5,
    "thread_id": "th_1",
    "task_id": "tk_1",
    "run_id": "run_1",
    "ts": "2026-10-27T22:00:03.000Z",
    "event": {
      "type": "TextMessageEnd",
      "message_id": "msg_2"
    }
  },
  {
    "v": 1,
    "seq": 6,
    "thread_id": "th_1",
    "task_id": "tk_1",
    "run_id": "run_1",
    "ts": "2026-10-27T22:00:03.000Z",
    "event": {
      "type": "ToolCallStart",
      "tool_call_id": "call_c1",
      "title": "Run cargo test",
      "kind": "execute",
      "status": "in_progress"
    },
    "raw": {
      "source": "acp",
      "payload": {
        "sessionUpdate": "tool_call",
        "toolCallId": "call_c1",
        "title": "Run cargo test",
        "kind": "execute",
        "status": "in_progress"
      }
    }
  },
  {
    "v": 1,
    "seq": 7,
    "thread_id": "th_1",
    "task_id": "tk_1",
    "run_id": "run_1",
    "ts": "2026-10-27T22:00:04.000Z",
    "event": {
      "type": "ToolCallEnd",
      "tool_call_id": "call_c1",
      "status": "failed"
    }
  },
  {
    "v": 1,
    "seq": 8,
    "thread_id": "th_1",
    "task_id": "tk_1",
    "run_id": "run_1",
    "ts": "2026-10-27T22:00:04.000Z",
    "event": {
      "type": "RunError",
      "reason": "cancelled",
      "message": "the prompt turn was cancelled"
    },
    "raw": {
      "source": "acp",
      "payload": {
        "stopReason": "cancelled"
      }
    }
  }
]
