[
  {
    "v": 1,
    "seq": 1,
    "thread_id": "th_1",
    "task_id": null,
    "run_id": null,
    "ts": "2026-10-27T22:00:01.000Z",
    "event": {
      "type": "StateSnapshot",
      "scope": "usage",
      "snapshot": {
        "context_used": 1000,
        "context_size": 200000,
        "cost": null
      }
    },
    "raw": {
      "source": "acp",
      "payload": {
        "sessionUpdate": "usage_update",
        "used": 1000,
        "size": 200000
      }
    }
  },
  {
    "v": 1,
    "seq": 2,
    "thread_id": "th_1",
    "task_id": null,
    "run_id": null,
    "ts": "2026-10-27T22:00:06.000Z",
    "event": {
      "type": "StateSnapshot",
      "scope": "thread",
      "snapshot": {
        "title": "Warm-up",
        "pending_tasks": []
      }
    },
    "raw": {
      "source": "acp",
      "payload": {
        "sessionUpdate": "session_info_update",
        "title": "Warm-up"
      }
    }
  },
  {
    "v": 1,
    "seq": 3,
    "thread_id": "th_1",
    "task_id": "tk_1",
    "run_id": null,
    "ts": "2026-10-27T22:00:07.000Z",
    "event": {
      "type": "UserMessage",
      "message_id": "msg_1",
      "parts": [
        {
          "type": "text",
          "text": "Now for real."
        }
      ],
      "author": {
        "kind": "user",
        "id": "usr_local"
      }
    }
  },
  {
    "v": 1,
    "seq": 4,
    "thread_id": "th_1",
    "task_id": "tk_1",
    "run_id": "run_1",
    "ts": "2026-10-27T22:00:07.000Z",
    "event": {
      "type": "RunStarted",
      "reason": "prompt"
    }
  },
  {
    "v": 1,
    "seq": 5,
    "thread_id": "th_1",
    "task_id": "tk_1",
    "run_id": "run_1",
    "ts": "2026-10-27T22:00:08.000Z",
    "event": {
      "type": "TextMessageStart",
      "message_id": "msg_2",
      "role": "assistant"
    }
  },
  {
    "v": 1,
    "seq": 6,
    "thread_id": "th_1",
    "task_id": "tk_1",
    "run_id": "run_1",
    "ts": "2026-10-27T22:00:08.000Z",
    "event": {
      "type": "TextMessageContent",
      "message_id": "msg_2",
      "delta": "Hello."
    },
    "raw": {
      "source": "acp",
      "payload": {
        "sessionUpdate": "agent_message_chunk",
        "content": {
          "type": "text",
          "text": "Hello."
        }
      }
    }
  },
  {
    "v": 1,
    "seq": 7,
    "thread_id": "th_1",
    "task_id": "tk_1",
    "run_id": "run_1",
    "ts": "2026-10-27T22:00:09.000Z",
    "event": {
      "type": "TextMessageEnd",
      "message_id": "msg_2"
    }
  },
  {
    "v": 1,
    "seq": 8,
    "thread_id": "th_1",
    "task_id": "tk_1",
    "run_id": "run_1",
    "ts": "2026-10-27T22:00:09.000Z",
    "event": {
      "type": "RunFinished",
      "outcome": {
        "type": "success",
        "stop_reason": "end_turn"
      }
    },
    "raw": {
      "source": "acp",
      "payload": {
        "stopReason": "end_turn"
      }
    }
  }
]
