[
  {
    "v": 1,
    "seq": 1,
    "thread_id": "th_1",
    "task_id": "tk_1",
    "run_id": null,
    "ts": "2026-10-27T22:00:01.000Z",
    "event": {
      "type": "UserMessage",
      "message_id": "msg_1",
      "parts": [
        {
          "type": "text",
          "text": "First prompt."
        }
      ],
      "author": {
        "kind": "user",
        "id": "usr_local"
      }
    }
  },
  {
    "v": 1,
    "seq": 2,
    "thread_id": "th_1",
    "task_id": "tk_1",
    "run_id": "run_1",
    "ts": "2026-10-27T22:00:01.000Z",
    "event": {
      "type": "RunStarted",
      "reason": "prompt"
    }
  },
  {
    "v": 1,
    "seq": 3,
    "thread_id": "th_1",
    "task_id": "tk_1",
    "run_id": "run_1",
    "ts": "2026-10-27T22:00:02.000Z",
    "event": {
      "type": "TextMessageStart",
      "message_id": "msg_2",
      "role": "assistant"
    }
  },
  {
    "v": 1,
    "seq": 4,
    "thread_id": "th_1",
    "task_id": "tk_1",
    "run_id": "run_1",
    "ts": "2026-10-27T22:00:02.000Z",
    "event": {
      "type": "TextMessageContent",
      "message_id": "msg_2",
      "delta": "Working..."
    },
    "raw": {
      "source": "acp",
      "payload": {
        "sessionUpdate": "agent_message_chunk",
        "content": {
          "type": "text",
          "text": "Working..."
        }
      }
    }
  },
  {
    "v": 1,
    "seq": 5,
    "thread_id": "th_1",
    "task_id": "tk_1",
    "run_id": "run_1",
    "ts": "2026-10-27T22:00:03.000Z",
    "event": {
      "type": "TextMessageEnd",
      "message_id": "msg_2"
    }
  },
  {
    "v": 1,
    "seq": 6,
    "thread_id": "th_1",
    "task_id": "tk_1",
    "run_id": "run_1",
    "ts": "2026-10-27T22:00:03.000Z",
    "event": {
      "type": "RunError",
      "reason": "error",
      "code": "protocol",
      "message": "a new task started before the previous one ended"
    }
  },
  {
    "v": 1,
    "seq": 7,
    "thread_id": "th_1",
    "task_id": "tk_2",
    "run_id": null,
    "ts": "2026-10-27T22:00:03.000Z",
    "event": {
      "type": "UserMessage",
      "message_id": "msg_3",
      "parts": [
        {
          "type": "text",
          "text": "Second prompt, sent too early."
        }
      ],
      "author": {
        "kind": "user",
        "id": "usr_local"
      }
    }
  },
  {
    "v": 1,
    "seq": 8,
    "thread_id": "th_1",
    "task_id": "tk_2",
    "run_id": "run_2",
    "ts": "2026-10-27T22:00:03.000Z",
    "event": {
      "type": "RunStarted",
      "reason": "prompt"
    }
  },
  {
    "v": 1,
    "seq": 9,
    "thread_id": "th_1",
    "task_id": "tk_2",
    "run_id": "run_2",
    "ts": "2026-10-27T22:00:04.000Z",
    "event": {
      "type": "TextMessageStart",
      "message_id": "msg_4",
      "role": "assistant"
    }
  },
  {
    "v": 1,
    "seq": 10,
    "thread_id": "th_1",
    "task_id": "tk_2",
    "run_id": "run_2",
    "ts": "2026-10-27T22:00:04.000Z",
    "event": {
      "type": "TextMessageContent",
      "message_id": "msg_4",
      "delta": "Answer."
    },
    "raw": {
      "source": "acp",
      "payload": {
        "sessionUpdate": "agent_message_chunk",
        "content": {
          "type": "text",
          "text": "Answer."
        }
      }
    }
  },
  {
    "v": 1,
    "seq": 11,
    "thread_id": "th_1",
    "task_id": "tk_2",
    "run_id": "run_2",
    "ts": "2026-10-27T22:00:05.000Z",
    "event": {
      "type": "TextMessageEnd",
      "message_id": "msg_4"
    }
  },
  {
    "v": 1,
    "seq": 12,
    "thread_id": "th_1",
    "task_id": "tk_2",
    "run_id": "run_2",
    "ts": "2026-10-27T22:00:05.000Z",
    "event": {
      "type": "RunFinished",
      "outcome": {
        "type": "success",
        "stop_reason": "end_turn"
      }
    },
    "raw": {
      "source": "acp",
      "payload": {
        "stopReason": "end_turn"
      }
    }
  }
]
