[
  {
    "v": 1,
    "seq": 1,
    "thread_id": "th_1",
    "task_id": "tk_1",
    "run_id": null,
    "ts": "2026-10-27T22:00:01.000Z",
    "event": {
      "type": "UserMessage",
      "message_id": "msg_1",
      "parts": [
        {
          "type": "text",
          "text": "Fix the parser."
        }
      ],
      "author": {
        "kind": "user",
        "id": "usr_local"
      }
    }
  },
  {
    "v": 1,
    "seq": 2,
    "thread_id": "th_1",
    "task_id": "tk_1",
    "run_id": "run_1",
    "ts": "2026-10-27T22:00:01.000Z",
    "event": {
      "type": "RunStarted",
      "reason": "prompt"
    }
  },
  {
    "v": 1,
    "seq": 3,
    "thread_id": "th_1",
    "task_id": "tk_1",
    "run_id": "run_1",
    "ts": "2026-10-27T22:00:02.000Z",
    "event": {
      "type": "ToolCallStart",
      "tool_call_id": "call_d1",
      "title": "Edit src/parser.rs",
      "kind": "edit",
      "status": "pending",
      "locations": [
        {
          "path": "src/parser.rs"
        }
      ]
    },
    "raw": {
      "source": "acp",
      "payload": {
        "sessionUpdate": "tool_call",
        "toolCallId": "call_d1",
        "title": "Edit src/parser.rs",
        "kind": "edit",
        "status": "pending",
        "locations": [
          {
            "path": "src/parser.rs"
          }
        ],
        "content": [
          {
            "type": "diff",
            "path": "src/parser.rs",
            "newText": "fn parse() -> Tree {}\n",
            "oldText": "fn parse() {}\n"
          }
        ]
      }
    }
  },
  {
    "v": 1,
    "seq": 4,
    "thread_id": "th_1",
    "task_id": "tk_1",
    "run_id": "run_1",
    "ts": "2026-10-27T22:00:02.000Z",
    "event": {
      "type": "Activity",
      "activity_id": "call_d1:src/parser.rs",
      "activity_type": "diff",
      "mode": "snapshot",
      "content": {
        "tool_call_id": "call_d1",
        "path": "src/parser.rs",
        "old_text": "fn parse() {}\n",
        "new_text": "fn parse() -> Tree {}\n"
      }
    },
    "raw": {
      "source": "acp",
      "payload": {
        "sessionUpdate": "tool_call",
        "toolCallId": "call_d1",
        "title": "Edit src/parser.rs",
        "kind": "edit",
        "status": "pending",
        "locations": [
          {
            "path": "src/parser.rs"
          }
        ],
        "content": [
          {
            "type": "diff",
            "path": "src/parser.rs",
            "newText": "fn parse() -> Tree {}\n",
            "oldText": "fn parse() {}\n"
          }
        ]
      }
    }
  },
  {
    "v": 1,
    "seq": 5,
    "thread_id": "th_1",
    "task_id": "tk_1",
    "run_id": "run_1",
    "ts": "2026-10-27T22:00:03.000Z",
    "event": {
      "type": "ToolCallStart",
      "tool_call_id": "call_d1",
      "status": "in_progress"
    },
    "raw": {
      "source": "acp",
      "payload": {
        "sessionUpdate": "tool_call_update",
        "toolCallId": "call_d1",
        "status": "in_progress",
        "content": [
          {
            "type": "diff",
            "path": "src/parser.rs",
            "newText": "fn parse() -> Tree {}\n",
            "oldText": "fn parse() {}\n"
          }
        ]
      }
    }
  },
  {
    "v": 1,
    "seq": 6,
    "thread_id": "th_1",
    "task_id": "tk_1",
    "run_id": "run_1",
    "ts": "2026-10-27T22:00:04.000Z",
    "event": {
      "type": "Activity",
      "activity_id": "call_d1:src/lib.rs",
      "activity_type": "diff",
      "mode": "snapshot",
      "content": {
        "tool_call_id": "call_d1",
        "path": "src/lib.rs",
        "old_text": null,
        "new_text": "pub mod parser;\n"
      }
    },
    "raw": {
      "source": "acp",
      "payload": {
        "sessionUpdate": "tool_call_update",
        "toolCallId": "call_d1",
        "status": "completed",
        "content": [
          {
            "type": "diff",
            "path": "src/parser.rs",
            "newText": "fn parse() -> Tree {}\n",
            "oldText": "fn parse() {}\n"
          },
          {
            "type": "diff",
            "path": "src/lib.rs",
            "newText": "pub mod parser;\n"
          }
        ]
      }
    }
  },
  {
    "v": 1,
    "seq": 7,
    "thread_id": "th_1",
    "task_id": "tk_1",
    "run_id": "run_1",
    "ts": "2026-10-27T22:00:04.000Z",
    "event": {
      "type": "ToolCallEnd",
      "tool_call_id": "call_d1",
      "status": "completed"
    },
    "raw": {
      "source": "acp",
      "payload": {
        "sessionUpdate": "tool_call_update",
        "toolCallId": "call_d1",
        "status": "completed",
        "content": [
          {
            "type": "diff",
            "path": "src/parser.rs",
            "newText": "fn parse() -> Tree {}\n",
            "oldText": "fn parse() {}\n"
          },
          {
            "type": "diff",
            "path": "src/lib.rs",
            "newText": "pub mod parser;\n"
          }
        ]
      }
    }
  },
  {
    "v": 1,
    "seq": 8,
    "thread_id": "th_1",
    "task_id": "tk_1",
    "run_id": "run_1",
    "ts": "2026-10-27T22:00:05.000Z",
    "event": {
      "type": "ToolCallStart",
      "tool_call_id": "call_d2",
      "title": "Create src/new.rs",
      "kind": "edit"
    },
    "raw": {
      "source": "acp",
      "payload": {
        "sessionUpdate": "tool_call",
        "toolCallId": "call_d2",
        "title": "Create src/new.rs",
        "kind": "edit",
        "status": "completed",
        "content": [
          {
            "type": "diff",
            "path": "src/new.rs",
            "newText": "// new file\n"
          }
        ]
      }
    }
  },
  {
    "v": 1,
    "seq": 9,
    "thread_id": "th_1",
    "task_id": "tk_1",
    "run_id": "run_1",
    "ts": "2026-10-27T22:00:05.000Z",
    "event": {
      "type": "Activity",
      "activity_id": "call_d2:src/new.rs",
      "activity_type": "diff",
      "mode": "snapshot",
      "content": {
        "tool_call_id": "call_d2",
        "path": "src/new.rs",
        "old_text": null,
        "new_text": "// new file\n"
      }
    },
    "raw": {
      "source": "acp",
      "payload": {
        "sessionUpdate": "tool_call",
        "toolCallId": "call_d2",
        "title": "Create src/new.rs",
        "kind": "edit",
        "status": "completed",
        "content": [
          {
            "type": "diff",
            "path": "src/new.rs",
            "newText": "// new file\n"
          }
        ]
      }
    }
  },
  {
    "v": 1,
    "seq": 10,
    "thread_id": "th_1",
    "task_id": "tk_1",
    "run_id": "run_1",
    "ts": "2026-10-27T22:00:05.000Z",
    "event": {
      "type": "ToolCallEnd",
      "tool_call_id": "call_d2",
      "status": "completed"
    },
    "raw": {
      "source": "acp",
      "payload": {
        "sessionUpdate": "tool_call",
        "toolCallId": "call_d2",
        "title": "Create src/new.rs",
        "kind": "edit",
        "status": "completed",
        "content": [
          {
            "type": "diff",
            "path": "src/new.rs",
            "newText": "// new file\n"
          }
        ]
      }
    }
  },
  {
    "v": 1,
    "seq": 11,
    "thread_id": "th_1",
    "task_id": "tk_1",
    "run_id": "run_1",
    "ts": "2026-10-27T22:00:06.000Z",
    "event": {
      "type": "RunFinished",
      "outcome": {
        "type": "success",
        "stop_reason": "end_turn"
      }
    },
    "raw": {
      "source": "acp",
      "payload": {
        "stopReason": "end_turn"
      }
    }
  }
]
